{
  "id": "starter.items.list",
  "kind": "data",
  "version": "0.1.0",
  "input": {
    "filter": "string"
  },
  "output": {
    "items": "array<{ id: string, title: string, body: string, created_at: datetime }>"
  },
  "side_effects": ["reads:starter_items"],
  "permissions": ["starter:read"],
  "confirmation": "none",
  "rate_limit": "60/min/user",
  "reversible": true
}
